{
  "$schema": "http://json-schema.org/draft-07/schema#",
  "title": "Branching Narrative",
  "type": "object",
  "properties": {
    "metadata": {
      "type": "object",
      "properties": {
        "title": { "type": "string" },
        "author": { "type": "string" },
        "version": { "type": "string" },
        "language": { "type": "string" }
      },
      "required": ["title", "author", "language"]
    },
    "characters": {
      "type": "array",
      "items": {
        "type": "object",
        "properties": {
          "id": { "type": "string" },
          "name": { "type": "string" },
          "portrait": { "type": "string" }
        },
        "required": ["id", "name"]
      }
    },
    "localization": {
      "type": "object",
      "additionalProperties": {
        "type": "object",
        "properties": {
          "language": { "type": "string" },
          "translations": {
            "type": "object",
            "additionalProperties": { "type": "string" }
          }
        },
        "required": ["language", "translations"]
      }
    },
    "nodes": {
      "type": "array",
      "items": {
        "type": "object",
        "properties": {
          "id": { "type": "string" },
          "character": { "type": "string" },
          "text": { "type": "string" },
          "text_id": { "type": "string" },
          "choices": {
            "type": "array",
            "items": {
              "type": "object",
              "properties": {
                "text": { "type": "string" },
                "text_id": { "type": "string" },
                "target": { "type": "string" },
                "conditions": {
                  "type": "array",
                  "items": {
                    "type": "object",
                    "properties": {
                      "variable": { "type": "string" },
                      "comparison": { "type": "string" },
                      "value": { "type": ["string", "number", "boolean"] }
                    },
                    "required": ["variable", "comparison", "value"]
                  }
                }
              },
              "required": ["text_id", "target"]
            }
          },
          "actions": {
            "type": "array",
            "items": {
              "type": "object",
              "properties": {
                "type": { "type": "string" },
                "variable": { "type": "string" },
                "value": { "type": ["string", "number", "boolean"] }
              },
              "required": ["type", "variable", "value"]
            }
          },
          "goto": { "type": "string" }
        },
        "required": ["id"]
      }
    }
  },
  "required": ["metadata", "characters", "nodes"]
}
